{
    "artifact_status": "complete",
    "artifact_status_note": null,
    "artifact_schema_id": "source_case_manifest_v1",
    "source_case_manifest_id": "UNH_2024_2025_10k_item1a__source_case_manifest_v1",
    "fixture_id": "UNH_2024_2025_10k_item1a",
    "ticker": "UNH",
    "issuer_name": "UnitedHealth Group Incorporated",
    "form_type": "10-K",
    "section_id": "item_1a",
    "year_from": 2024,
    "year_to": 2025,
    "source_filing_paths": {
        "2024": "data/sec_cache/filings/0000731766/0000731766-25-000063/filing.txt.gz",
        "2025": "data/sec_cache/filings/0000731766/0000731766-26-000062/filing.txt.gz"
    },
    "years": [
        {
            "fiscal_year": 2024,
            "year_label": "FY2024",
            "status": "complete",
            "status_note": null,
            "accession_number": "0000731766-25-000063",
            "filing_date": "2025-02-27",
            "report_date": "2024-12-31",
            "cik": "0000731766",
            "form_type": "10-K",
            "section_id": "item_1a",
            "filing_meta_path": "data/sec_cache/filings/0000731766/0000731766-25-000063/filing_meta.json",
            "filing_text_path": "data/sec_cache/filings/0000731766/0000731766-25-000063/filing.txt.gz",
            "risk_raw_text_path": "data/sec_cache/filings/0000731766/0000731766-25-000063/risk/item_1a.raw.txt.gz",
            "risk_clean_text_path": "data/sec_cache/filings/0000731766/0000731766-25-000063/risk/item_1a.txt.gz",
            "risk_segments_path": "data/sec_cache/filings/0000731766/0000731766-25-000063/risk/item_1a.segments.json.gz",
            "rf_meta_path": "data/sec_cache/filings/0000731766/0000731766-25-000063/risk/rf_meta.json",
            "reuse_filtered_year_input_path": null,
            "extraction_metadata": {
                "source_origin": "ticker_year_index",
                "rf_meta_method": "blockdoc_scored",
                "rf_meta_confidence": 0.8999999999999999,
                "rf_meta_status": "REVIEW",
                "rf_meta_warnings": [
                    "toc_header_repeated",
                    "toc_detected"
                ],
                "rf_meta_candidate_count": 1
            },
            "integrity": {
                "filing_text_sha256": "15819b3c0bfc0252637ae945dd4d4dde95726fb4643a8ebae64aadebaf3cd219",
                "risk_text_sha256": "4bbec6ce86b1959c6f67798d300c1765ee6d04d3d618a8a343f6fe369f036d8f",
                "risk_paragraph_count": 91,
                "required_paths_exist": true
            },
            "availability_status": "available",
            "extraction_quality_status": "review_required",
            "analysis_readiness_status": "pilot_ready",
            "qc_summary": {
                "quality_gate_result": "review",
                "confidence_band": "high",
                "paragraph_count_plausibility": "plausible",
                "severe_warning_flags": [],
                "readiness_derivation_note": "High-confidence review case: source files, tagged segments present, rf_meta_status is REVIEW."
            }
        },
        {
            "fiscal_year": 2025,
            "year_label": "FY2025",
            "status": "complete",
            "status_note": null,
            "accession_number": "0000731766-26-000062",
            "filing_date": "2026-03-02",
            "report_date": "2025-12-31",
            "cik": "0000731766",
            "form_type": "10-K",
            "section_id": "item_1a",
            "filing_meta_path": "data/sec_cache/filings/0000731766/0000731766-26-000062/filing_meta.json",
            "filing_text_path": "data/sec_cache/filings/0000731766/0000731766-26-000062/filing.txt.gz",
            "risk_raw_text_path": "data/sec_cache/filings/0000731766/0000731766-26-000062/risk/item_1a.raw.txt.gz",
            "risk_clean_text_path": "data/sec_cache/filings/0000731766/0000731766-26-000062/risk/item_1a.txt.gz",
            "risk_segments_path": "data/sec_cache/filings/0000731766/0000731766-26-000062/risk/item_1a.segments.json.gz",
            "rf_meta_path": "data/sec_cache/filings/0000731766/0000731766-26-000062/risk/rf_meta.json",
            "reuse_filtered_year_input_path": null,
            "extraction_metadata": {
                "source_origin": "ticker_year_index",
                "rf_meta_method": "blockdoc_scored",
                "rf_meta_confidence": 0.8999999999999999,
                "rf_meta_status": "REVIEW",
                "rf_meta_warnings": [
                    "toc_header_repeated",
                    "toc_detected"
                ],
                "rf_meta_candidate_count": 1
            },
            "integrity": {
                "filing_text_sha256": "de9b7917b47d59000e31f53abd851f397fb04c464bda236d7db2d7c4e2da1b0b",
                "risk_text_sha256": "177a060424a744dd254e61da758540f3fa02afcbbbce34cf8947694475467af1",
                "risk_paragraph_count": 98,
                "required_paths_exist": true
            },
            "availability_status": "available",
            "extraction_quality_status": "review_required",
            "analysis_readiness_status": "pilot_ready",
            "qc_summary": {
                "quality_gate_result": "review",
                "confidence_band": "high",
                "paragraph_count_plausibility": "plausible",
                "severe_warning_flags": [],
                "readiness_derivation_note": "High-confidence review case: source files, tagged segments present, rf_meta_status is REVIEW."
            }
        }
    ],
    "pair_reuse_filtered_input_path": null,
    "integrity": {
        "complete_year_count": 2,
        "all_required_files_present": true
    },
    "notes": [
        "UNH Wave 4A.5 backfill target with local FY2024/FY2025 cache.",
        "Canonical readiness lives in availability_status, extraction_quality_status, analysis_readiness_status, and qc_summary."
    ],
    "availability_status": "available",
    "extraction_quality_status": "review_required",
    "analysis_readiness_status": "pilot_ready",
    "qc_summary": {
        "quality_gate_result": "review",
        "confidence_band": "high",
        "paragraph_count_plausibility": "plausible",
        "severe_warning_flags": [],
        "readiness_derivation_note": "All required source paths present; extraction remains review_required because rf_meta_status is REVIEW."
    }
}