{
    "artifact_status":  "complete",
    "artifact_status_note":  null,
    "artifact_schema_id":  "source_case_manifest_v1",
    "source_case_manifest_id":  "NVDA_2024_2025_10k_item1a__source_case_manifest_v1",
    "fixture_id":  "NVDA_2024_2025_10k_item1a",
    "ticker":  "NVDA",
    "issuer_name":  "NVIDIA Corporation",
    "form_type":  "10-K",
    "section_id":  "item_1a",
    "year_from":  2024,
    "year_to":  2025,
    "source_filing_paths":  {
                                "2024":  "data/sec_cache/filings/0001045810/0001045810-24-000029/filing.txt.gz",
                                "2025":  "data/sec_cache/filings/0001045810/0001045810-25-000023/filing.txt.gz"
                            },
    "years":  [
                  {
                      "fiscal_year":  2024,
                      "year_label":  "FY2024",
                      "status":  "complete",
                      "status_note":  null,
                      "accession_number":  "0001045810-24-000029",
                      "filing_date":  "2024-02-21",
                      "report_date":  "2024-01-28",
                      "cik":  "0001045810",
                      "form_type":  "10-K",
                      "section_id":  "item_1a",
                      "filing_meta_path":  "data/sec_cache/filings/0001045810/0001045810-24-000029/filing_meta.json",
                      "filing_text_path":  "data/sec_cache/filings/0001045810/0001045810-24-000029/filing.txt.gz",
                      "risk_raw_text_path":  "data/sec_cache/filings/0001045810/0001045810-24-000029/risk/item_1a.raw.txt.gz",
                      "risk_clean_text_path":  "data/sec_cache/filings/0001045810/0001045810-24-000029/risk/item_1a.txt.gz",
                      "risk_segments_path":  "data/sec_cache/filings/0001045810/0001045810-24-000029/risk/item_1a.segments.json.gz",
                      "rf_meta_path":  "data/sec_cache/filings/0001045810/0001045810-24-000029/risk/rf_meta.json",
                      "reuse_filtered_year_input_path":  "public/data/sec_narrative_drift_lab/llm_inputs_v2/inputs/year/NVDA_2024_10k_item1a_deboilerplated_edgar__pair_2024_2025.json",
                      "extraction_metadata":  {
                                                  "source_origin":  "ticker_year_index",
                                                  "rf_meta_method":  "blockdoc_scored",
                                                  "rf_meta_confidence":  0.8999999999999999,
                                                  "rf_meta_status":  "REVIEW",
                                                  "rf_meta_warnings":  [
                                                                           "toc_header_repeated",
                                                                           "toc_detected"
                                                                       ],
                                                  "rf_meta_candidate_count":  2
                                              },
                      "integrity":  {
                                        "filing_text_sha256":  "f1d50265b53da2167898eed97b24c594181f817c3501d17f706119ad19745dfc",
                                        "risk_text_sha256":  "11d4f2257e3a2633320afeb8382c7ba7262f4861af65a918dd1ec7f8cdb6b30a",
                                        "risk_paragraph_count":  110,
                                        "required_paths_exist":  true
                                    },
                      "availability_status":  "available",
                      "extraction_quality_status":  "review_required",
                      "analysis_readiness_status":  "pilot_ready",
                      "qc_summary":  {
                                         "quality_gate_result":  "review",
                                         "confidence_band":  "high",
                                         "paragraph_count_plausibility":  "plausible",
                                         "severe_warning_flags":  [

                                                                  ],
                                         "readiness_derivation_note":  "High-confidence review case: source files, tagged segments, and reuse-filtered year input are present, but rf_meta_status remains REVIEW."
                                     }
                  },
                  {
                      "fiscal_year":  2025,
                      "year_label":  "FY2025",
                      "status":  "complete",
                      "status_note":  null,
                      "accession_number":  "0001045810-25-000023",
                      "filing_date":  "2025-02-26",
                      "report_date":  "2025-01-26",
                      "cik":  "0001045810",
                      "form_type":  "10-K",
                      "section_id":  "item_1a",
                      "filing_meta_path":  "data/sec_cache/filings/0001045810/0001045810-25-000023/filing_meta.json",
                      "filing_text_path":  "data/sec_cache/filings/0001045810/0001045810-25-000023/filing.txt.gz",
                      "risk_raw_text_path":  "data/sec_cache/filings/0001045810/0001045810-25-000023/risk/item_1a.raw.txt.gz",
                      "risk_clean_text_path":  "data/sec_cache/filings/0001045810/0001045810-25-000023/risk/item_1a.txt.gz",
                      "risk_segments_path":  "data/sec_cache/filings/0001045810/0001045810-25-000023/risk/item_1a.segments.json.gz",
                      "rf_meta_path":  "data/sec_cache/filings/0001045810/0001045810-25-000023/risk/rf_meta.json",
                      "reuse_filtered_year_input_path":  "public/data/sec_narrative_drift_lab/llm_inputs_v2/inputs/year/NVDA_2025_10k_item1a_deboilerplated_edgar__pair_2024_2025.json",
                      "extraction_metadata":  {
                                                  "source_origin":  "ticker_year_index",
                                                  "rf_meta_method":  "blockdoc_scored",
                                                  "rf_meta_confidence":  0.8999999999999999,
                                                  "rf_meta_status":  "REVIEW",
                                                  "rf_meta_warnings":  [
                                                                           "toc_header_repeated",
                                                                           "toc_detected"
                                                                       ],
                                                  "rf_meta_candidate_count":  2
                                              },
                      "integrity":  {
                                        "filing_text_sha256":  "0fd363ee642e5c99c0884989a15183d9169e687949c1753b177bf9d6d0ae49be",
                                        "risk_text_sha256":  "d125c11a7f2dc92a8c43f9f8db7dcb437d1616262240a9e47d847c956b01604a",
                                        "risk_paragraph_count":  117,
                                        "required_paths_exist":  true
                                    },
                      "availability_status":  "available",
                      "extraction_quality_status":  "review_required",
                      "analysis_readiness_status":  "pilot_ready",
                      "qc_summary":  {
                                         "quality_gate_result":  "review",
                                         "confidence_band":  "high",
                                         "paragraph_count_plausibility":  "plausible",
                                         "severe_warning_flags":  [

                                                                  ],
                                         "readiness_derivation_note":  "High-confidence review case: source files, tagged segments, and reuse-filtered year input are present, but rf_meta_status remains REVIEW."
                                     }
                  }
              ],
    "pair_reuse_filtered_input_path":  "public/data/sec_narrative_drift_lab/llm_inputs_v2/inputs/pair/NVDA_2024_2025_10k_item1a_deboilerplated_edgar.json",
    "integrity":  {
                      "complete_year_count":  2,
                      "all_required_files_present":  true
                  },
    "notes":  [
                  "NVDA is the canonical Wave 4A.5 ablation target.",
                  "Pair reuse-filtered path points at the current llm_inputs_v2 deboilerplated pair manifest.",
                  "Canonical readiness lives in availability_status, extraction_quality_status, analysis_readiness_status, and qc_summary.",
                  "The deferred i3_extractive_evidence_packet_v1 remains topology-only and does not lift NVDA to matrix_ready."
              ],
    "availability_status":  "available",
    "extraction_quality_status":  "review_required",
    "analysis_readiness_status":  "pilot_ready",
    "qc_summary":  {
                       "quality_gate_result":  "review",
                       "confidence_band":  "high",
                       "paragraph_count_plausibility":  "plausible",
                       "severe_warning_flags":  [

                                                ],
                       "readiness_derivation_note":  "All required source paths and P0/P1/P2 pilot inputs are present; extraction remains review-required because rf_meta_status is REVIEW and table-of-contents warnings persist."
                   }
}
